{
  "$schema": "https://json-schema.org/draft/2020-12/schema",
  "type": "object",
  "additionalProperties": false,
  "$id": "https://disponit.no/skjema/m44kampanjeartefakt-v1.json",
  "title": "M-44 kampanjeartefakt (m44-kampanje-v1)",
  "comment": "ARC B kampanje, de ti punktene (PR 6). Hvert punkt er et par (forsok, brudd) - null brudd uten minst ett forsok er en port som aldri kjorte. Feltsettet er generert fra manifestskjema.M44_KAMPANJE_INVARIANTER, aldri for haand; grensene staar i KRAVGRENSER.",
  "required": [
    "krav_id",
    "ts",
    "bestatt",
    "oppsett",
    "maalt",
    "funn"
  ],
  "properties": {
    "krav_id": {
      "const": "m44-kampanje-v1"
    },
    "ts": {
      "type": "string",
      "minLength": 1
    },
    "bestatt": {
      "type": "boolean"
    },
    "oppsett": {
      "type": "object",
      "additionalProperties": false,
      "required": [
        "modul",
        "commit",
        "vert",
        "tenant"
      ],
      "properties": {
        "modul": {
          "const": "m44_kampanje"
        },
        "commit": {
          "type": "string",
          "pattern": "^[0-9a-f]{40}$"
        },
        "vert": {
          "type": "string",
          "minLength": 1
        },
        "tenant": {
          "type": "string",
          "minLength": 1
        },
        "release": {
          "type": "string"
        },
        "notat": {
          "type": "string"
        }
      }
    },
    "maalt": {
      "type": "object",
      "additionalProperties": false,
      "required": [
        "adresse_i_klartekst_utenfor_registeret_forsok",
        "adresse_i_klartekst_utenfor_registeret_brudd",
        "bestilling_uten_policy_forsok",
        "bestilling_uten_policy_brudd",
        "levering_uten_samtykke_forsok",
        "levering_uten_samtykke_brudd",
        "dobbel_bestilling_samme_par_forsok",
        "dobbel_bestilling_samme_par_brudd",
        "dobbel_levering_samme_oppdrag_forsok",
        "dobbel_levering_samme_oppdrag_brudd",
        "levering_uten_avmeldingslenke_forsok",
        "levering_uten_avmeldingslenke_brudd",
        "innhold_eller_adresse_mangler_forsok",
        "innhold_eller_adresse_mangler_brudd",
        "policygrense_omgaatt_forsok",
        "policygrense_omgaatt_brudd",
        "kvittering_uten_bokforing_forsok",
        "kvittering_uten_bokforing_brudd",
        "kill_switch_konsumerte_par_forsok",
        "kill_switch_konsumerte_par_brudd",
        "rundtur_paa_disponit_com"
      ],
      "properties": {
        "adresse_i_klartekst_utenfor_registeret_forsok": {
          "type": "integer",
          "minimum": 0
        },
        "adresse_i_klartekst_utenfor_registeret_brudd": {
          "type": "integer",
          "minimum": 0
        },
        "bestilling_uten_policy_forsok": {
          "type": "integer",
          "minimum": 0
        },
        "bestilling_uten_policy_brudd": {
          "type": "integer",
          "minimum": 0
        },
        "levering_uten_samtykke_forsok": {
          "type": "integer",
          "minimum": 0
        },
        "levering_uten_samtykke_brudd": {
          "type": "integer",
          "minimum": 0
        },
        "dobbel_bestilling_samme_par_forsok": {
          "type": "integer",
          "minimum": 0
        },
        "dobbel_bestilling_samme_par_brudd": {
          "type": "integer",
          "minimum": 0
        },
        "dobbel_levering_samme_oppdrag_forsok": {
          "type": "integer",
          "minimum": 0
        },
        "dobbel_levering_samme_oppdrag_brudd": {
          "type": "integer",
          "minimum": 0
        },
        "levering_uten_avmeldingslenke_forsok": {
          "type": "integer",
          "minimum": 0
        },
        "levering_uten_avmeldingslenke_brudd": {
          "type": "integer",
          "minimum": 0
        },
        "innhold_eller_adresse_mangler_forsok": {
          "type": "integer",
          "minimum": 0
        },
        "innhold_eller_adresse_mangler_brudd": {
          "type": "integer",
          "minimum": 0
        },
        "policygrense_omgaatt_forsok": {
          "type": "integer",
          "minimum": 0
        },
        "policygrense_omgaatt_brudd": {
          "type": "integer",
          "minimum": 0
        },
        "kvittering_uten_bokforing_forsok": {
          "type": "integer",
          "minimum": 0
        },
        "kvittering_uten_bokforing_brudd": {
          "type": "integer",
          "minimum": 0
        },
        "kill_switch_konsumerte_par_forsok": {
          "type": "integer",
          "minimum": 0
        },
        "kill_switch_konsumerte_par_brudd": {
          "type": "integer",
          "minimum": 0
        },
        "rundtur_paa_disponit_com": {
          "type": "boolean",
          "description": "Bevisrunden gikk mot disponit.com med et EKTE oppdrag gjennom modulen (ikke stub-SMTP) - kvitteringen staar i basen."
        }
      }
    },
    "funn": {
      "type": "array",
      "items": {
        "type": "object",
        "additionalProperties": false,
        "required": [
          "alvor",
          "tekstnokkel"
        ],
        "properties": {
          "alvor": {
            "enum": [
              "rodt",
              "gult"
            ]
          },
          "tekstnokkel": {
            "type": "string",
            "pattern": "^[a-z0-9][a-z0-9._-]{0,127}$"
          },
          "detalj": {
            "type": "object"
          }
        }
      },
      "description": "Funnene som tekstnokler + parametre (aldri fritekst-PII)."
    }
  }
}
